{
  "$schema": "https://json-schema.org/draft/2020-12/schema",
  "$id": "https://schemas.pattertech.eos/task-record.schema.json",
  "title": "EOS task record",
  "description": "Per-task JSON record at org/tasks/T-####.json, written by eos task via write-temp-then-rename. The agent proposes declared facts and tier_proposed; the router rules tier_ruled with machine-readable reasons. Resume exists only for interrupted work.",
  "type": "object",
  "additionalProperties": false,
  "required": [
    "id",
    "intent",
    "declared",
    "mode",
    "tier_proposed",
    "tier_ruled",
    "reasons",
    "status",
    "owner_session",
    "claims",
    "timestamps"
  ],
  "properties": {
    "id": {
      "type": "string",
      "pattern": "^T-\\d{4}$"
    },
    "intent": {
      "type": "string",
      "minLength": 1,
      "description": "What the task is for, one or two sentences."
    },
    "declared": {
      "type": "object",
      "additionalProperties": false,
      "required": ["capabilities", "side_effects"],
      "description": "Risk facts the owner declares up front. A fact the derived signals expose but the declaration missed is a gate-time discrepancy finding.",
      "properties": {
        "capabilities": {
          "type": "array",
          "items": { "type": "string" },
          "description": "Free text, for example network, database, filesystem-outside-repo. The router does not read this list and no factor cites it; it is context for the reviewer. side_effects is what rules the tier."
        },
        "side_effects": {
          "type": "array",
          "uniqueItems": true,
          "items": { "$ref": "#/$defs/sideEffect" },
          "description": "The declared half of the factor table's input. Every value here reaches a factor in kernel/POLICY_SPEC.md."
        }
      }
    },
    "mode": {
      "type": "string",
      "enum": ["express", "standard", "exploration", "high-assurance", "parallel"]
    },
    "tier_proposed": { "$ref": "#/$defs/tier" },
    "tier_ruled": { "$ref": "#/$defs/tier" },
    "reasons": {
      "type": "array",
      "items": { "$ref": "#/$defs/reason" },
      "description": "Machine-readable routing reasons. Empty only when no factor is active (clean R0)."
    },
    "status": {
      "type": "string",
      "enum": [
        "proposed",
        "active",
        "interrupted",
        "blocked",
        "in-review",
        "done",
        "discarded",
        "quarantined"
      ],
      "description": "quarantined marks unscheduled concurrent work parked on its branch for integrator adoption or discard; it is never deleted without operator authority."
    },
    "owner_session": {
      "type": "string",
      "minLength": 1
    },
    "claims": {
      "type": "array",
      "items": { "$ref": "#/$defs/pathClaim" },
      "description": "The path claims assigned to this task by the coordinator. Assignment lives in org/claims.json (claims.schema.json); this list is the task-side copy."
    },
    "timestamps": {
      "type": "object",
      "additionalProperties": false,
      "required": ["opened", "updated"],
      "properties": {
        "opened": { "$ref": "#/$defs/dateTime" },
        "updated": { "$ref": "#/$defs/dateTime" },
        "closed": { "$ref": "#/$defs/dateTime" }
      }
    },
    "hypothesis_ledger": {
      "type": "array",
      "items": {
        "type": "object",
        "additionalProperties": false,
        "required": ["hypothesis", "test", "result", "learning"],
        "properties": {
          "hypothesis": { "type": "string", "minLength": 1 },
          "test": { "type": "string", "minLength": 1 },
          "result": { "type": "string", "minLength": 1 },
          "learning": { "type": "string", "minLength": 1 }
        }
      },
      "description": "Circuit-breaker ledger. The breaker fires on three materially distinct falsified hypotheses with no reduction in uncertainty, not on a raw attempt count. Express converts to Standard before any entry is written."
    },
    "oracle_provenance": {
      "type": "object",
      "additionalProperties": false,
      "required": ["files", "hashes", "author_session", "independence_method"],
      "description": "High-assurance oracle record. Originals are never deleted; changes are append-only amendments authored by a non-implementer.",
      "properties": {
        "files": {
          "type": "array",
          "minItems": 1,
          "items": { "type": "string" }
        },
        "hashes": {
          "type": "object",
          "minProperties": 1,
          "additionalProperties": { "$ref": "#/$defs/sha256" },
          "description": "sha256 hex digest per oracle file path."
        },
        "author_session": { "type": "string", "minLength": 1 },
        "independence_method": {
          "type": "string",
          "enum": [
            "clean-context",
            "property-based",
            "differential",
            "metamorphic",
            "separate-model",
            "human-sampled"
          ]
        },
        "amendments": {
          "type": "array",
          "items": {
            "type": "object",
            "additionalProperties": false,
            "required": ["reason", "change", "old_hash", "new_hash", "author_session", "authorised_by", "date"],
            "properties": {
              "reason": { "type": "string", "minLength": 1 },
              "change": { "type": "string", "minLength": 1 },
              "old_hash": { "$ref": "#/$defs/sha256" },
              "new_hash": { "$ref": "#/$defs/sha256" },
              "author_session": {
                "type": "string",
                "minLength": 1,
                "description": "Must not be the implementer session. The implementer may request, never perform, an amendment."
              },
              "authorised_by": {
                "type": "string",
                "minLength": 1,
                "description": "REVIEWER at R2, operator at R3."
              },
              "date": { "$ref": "#/$defs/dateTime" }
            }
          }
        }
      }
    },
    "resume": {
      "type": "object",
      "additionalProperties": false,
      "required": [
        "eos_pin",
        "phase",
        "last_verified",
        "next_action",
        "blockers",
        "constraints",
        "files_in_flight"
      ],
      "description": "Present only while status is interrupted. A fresh session must be able to resume from these seven keys plus the files they name, alone.",
      "properties": {
        "eos_pin": { "type": "string" },
        "phase": { "type": "string" },
        "last_verified": { "type": "string" },
        "next_action": { "type": "string" },
        "blockers": { "$ref": "#/$defs/stringOrList" },
        "constraints": { "$ref": "#/$defs/stringOrList" },
        "files_in_flight": { "$ref": "#/$defs/stringOrList" }
      }
    },
    "verdicts": {
      "type": "array",
      "items": {
        "type": "object",
        "additionalProperties": false,
        "required": ["role", "session", "verdict", "date"],
        "properties": {
          "role": {
            "type": "string",
            "enum": ["REVIEWER", "ORACLE", "operator"]
          },
          "session": { "type": "string", "minLength": 1 },
          "verdict": {
            "type": "string",
            "enum": ["pass", "fail", "pass-with-repairs"],
            "description": "pass-with-repairs records trivia repaired in non-gate artefacts only, never in tests or checks."
          },
          "notes": { "type": "string" },
          "date": { "$ref": "#/$defs/dateTime" }
        }
      }
    }
  },
  "$defs": {
    "tier": {
      "type": "string",
      "enum": ["R0", "R1", "R2", "R3"]
    },
    "sideEffect": {
      "type": "string",
      "enum": [
        "sends-external",
        "writes-production-data",
        "migrates-schema",
        "touches-auth",
        "handles-pii",
        "financial-impact",
        "irreversible-action",
        "rollback-cost"
      ]
    },
    "reason": {
      "type": "object",
      "additionalProperties": false,
      "required": ["factor", "tier_floor", "source", "evidence"],
      "properties": {
        "factor": { "type": "string", "minLength": 1 },
        "tier_floor": { "$ref": "#/$defs/tier" },
        "source": {
          "type": "string",
          "enum": ["declared", "derived"]
        },
        "evidence": { "type": "string", "minLength": 1 }
      }
    },
    "pathClaim": {
      "type": "string",
      "pattern": "^(?![/\\\\])(?!.*\\\\)(?!.*\\.\\.).+$",
      "description": "Repository-relative forward-slash NFC path, compared case-folded; a trailing slash claims the whole directory prefix."
    },
    "sha256": {
      "type": "string",
      "pattern": "^[0-9a-f]{64}$"
    },
    "dateTime": {
      "type": "string",
      "format": "date-time",
      "pattern": "^\\d{4}-\\d{2}-\\d{2}T\\d{2}:\\d{2}"
    },
    "stringOrList": {
      "anyOf": [
        { "type": "string" },
        { "type": "array", "items": { "type": "string" } }
      ]
    }
  }
}
