{
  "id": "T-0026",
  "intent": "Implement the operator-approved Doctrine and Wargaming rebuild: first-class graded doctrine, one semantic Wargame model over stable GD/WG identities, commit-aware resolution, typed pressure relations, structured venture rulings, selective Session 0 matching, evidence-led coverage and generated public views. Invariants: existing IDs and paths resolve at current and historical pins; retired IDs never become live rulings; binding controls cannot be waived by an ordinary ruling; derived views have one canonical source; raw venture context is never harvested; no venture, release, tag or remote is mutated. Rollback: keep compatibility readers and frozen inventories until the new checks, migration round-trip and cold-clone gate pass; revert phase commits in reverse dependency order without rewriting venture repositories.",
  "declared": {
    "capabilities": [
      "network",
      "filesystem"
    ],
    "side_effects": [
      "migrates-schema",
      "sends-external"
    ]
  },
  "mode": "high-assurance",
  "tier_proposed": "R3",
  "tier_ruled": "R2",
  "reasons": [
    {
      "factor": "schema-change",
      "tier_floor": "R2",
      "source": "declared",
      "evidence": "declared side effect: migrates-schema"
    },
    {
      "factor": "boundary-contact",
      "tier_floor": "R1",
      "source": "declared",
      "evidence": "declared side effect: sends-external"
    }
  ],
  "status": "active",
  "owner_session": "doctrine-wargame-integrator",
  "claims": [
    "AGENTS.md",
    "CLAUDE.md",
    "GOVERNANCE.md",
    "INDEX.md",
    "README.md",
    "TOUR.md",
    "OPERATORS_GUIDE.md",
    "CHANGELOG.md",
    "archive/",
    "examples/",
    "inception/",
    "kernel/",
    "org/",
    "packs/",
    "registry/",
    "tests/",
    "tools/"
  ],
  "timestamps": {
    "opened": "2026-08-15T19:35:02Z",
    "updated": "2026-08-15T19:49:00Z"
  },
  "hypothesis_ledger": [],
  "oracle_provenance": {
    "files": [
      "tests/test_ontology_oracle.py"
    ],
    "hashes": {
      "tests/test_ontology_oracle.py": "5b0413cf0e934e27d3f7f1c00f43739717750ec1c8f780e6f475bb67617a31b9"
    },
    "author_session": "resolver-oracle-author",
    "independence_method": "property-based"
  }
}
