{
  "id": "T-0013",
  "intent": "Integrate the v2.1 build: Genesis, exemplar learning, the agentic-swarm pack and the de-restriction pass. Author ADR-0006, ADR-0007 and ADR-0008, apply ADR-0005, add Apache-2.0, then dispatch twelve lanes on disjoint paths, merge them, regenerate every derived view and run the review passes.",
  "claims": [
    "GOVERNANCE.md",
    "kernel/POLICY_SPEC.md",
    "org/",
    "LICENSE"
  ],
  "declared": {
    "capabilities": [],
    "side_effects": []
  },
  "mode": "standard",
  "tier_proposed": "R3",
  "status": "active",
  "owner_session": "eos-v21-integrator",
  "timestamps": {
    "opened": "2026-08-10T18:00:00Z",
    "updated": "2026-08-10T18:00:00Z"
  },
  "tier_ruled": "R0",
  "reasons": []
}
