{
  "id": "T-0004",
  "intent": "Pre-release review of feat/eos-v2-agentic-development, ruled by Daniel on 2026-08-04. Three antagonistic audits found the repository misdescribes itself in its machine-readable artefacts while its prose stays roughly honest. Fix what lies, cut what misleads, build the two safety controls that were documented and never implemented, wire pack activation so progressive disclosure actually happens, then rebuild the benchmark instrument and re-run it clean. The merge to main is halted until the gates are re-measured. Governed by ADR-0003.",
  "declared": {
    "capabilities": [
      "network"
    ],
    "side_effects": [
      "sends-external"
    ]
  },
  "mode": "high-assurance",
  "tier_proposed": "R3",
  "tier_ruled": "R1",
  "reasons": [
    {
      "factor": "boundary-contact",
      "tier_floor": "R1",
      "source": "declared",
      "evidence": "declared side effect: sends-external"
    }
  ],
  "status": "active",
  "owner_session": "eos-v2-prerelease-review",
  "claims": [
    ".github/",
    ".gitignore",
    "AGENTS.md",
    "CHANGELOG.md",
    "CLAUDE.md",
    "GOVERNANCE.md",
    "INDEX.md",
    "OPERATORS_GUIDE.md",
    "README.md",
    "TOUR.md",
    "archive/",
    "benchmark/",
    "estate/",
    "examples/",
    "inception/",
    "kernel/",
    "org/",
    "packs/",
    "pytest.ini",
    "registry/",
    "tests/",
    "tools/"
  ],
  "timestamps": {
    "opened": "2026-08-04T09:00:00Z",
    "updated": "2026-08-04T09:00:00Z"
  },
  "hypothesis_ledger": [],
  "oracle_provenance": {
    "files": [
      "benchmark/SEALED.json"
    ],
    "hashes": {
      "benchmark/SEALED.json": "4718e4071d7d97978e6c45898fc04764c44a5c8b3f81c7865e26e73b1e46bfb0"
    },
    "author_session": "sealed-evaluator-author-2026-08",
    "independence_method": "human-sampled"
  }
}
