{
  "id": "T-0023",
  "intent": "Six packs: stale prose, front-matter sources, the authority audit excluding production safety, the provenance fragment, and the exemplar-study rules legal-licensing owes the study workflow.",
  "claims": [
    "packs/devops-reliability/",
    "packs/docs-dx/",
    "packs/legal-licensing/",
    "packs/marketing-growth/",
    "packs/native-client/",
    "packs/pattertech-house/"
  ],
  "declared": {
    "capabilities": [],
    "side_effects": []
  },
  "mode": "standard",
  "tier_proposed": "R1",
  "status": "active",
  "owner_session": "eos-v21-L10",
  "timestamps": {
    "opened": "2026-08-10T18:00:00Z",
    "updated": "2026-08-10T18:00:00Z"
  },
  "tier_ruled": "R0",
  "reasons": []
}
