{
  "id": "T-0010",
  "intent": "Decide the twelve evidence records that nothing cites: EV-0002, EV-0013, EV-0014, EV-0031, EV-0032, EV-0033, EV-0042, EV-0047, EV-0049, EV-0054, EV-0072 and EV-0073. Mostly benchmarks and agent platforms gathered during research that never entered a pack argument. Each is either cited by a pack that should have used it, or pruned. The earlier report said a hundred and seven were uncited; that number counted the ledger's own self-reference and the derived INDEX.md as citations. Twelve is the measured figure and check S016 now holds it. A record nothing reads is weight rather than evidence, which ADR-0003 governs.",
  "claims": [
    "registry/evidence.json",
    "packs/"
  ],
  "declared": {
    "capabilities": [],
    "side_effects": []
  },
  "mode": "standard",
  "tier_proposed": "R1",
  "tier_ruled": "R0",
  "reasons": [],
  "status": "proposed",
  "owner_session": "eos-v2-prerelease-review",
  "timestamps": {
    "opened": "2026-08-08T00:00:00Z",
    "updated": "2026-08-08T00:00:00Z"
  }
}
