{
  "id": "T-0003",
  "intent": "Add the hexagonal boundary statement to the architecture pack (v1 queue item G2): ports at every vendor and IO seam, the domain never imports adapters, the config-only against code-port boundary distinction, with Venture A's ADR-0003 as the worked material. Held pending Venture A W1 per Daniel, 2026-07-07; ADR-0002 lifted the hold only for WG-DEL-005, so this item stays held.",
  "declared": {
    "capabilities": [],
    "side_effects": []
  },
  "mode": "standard",
  "tier_proposed": "R1",
  "tier_ruled": "R1",
  "reasons": [
    {
      "factor": "size-threshold",
      "tier_floor": "R1",
      "source": "derived",
      "evidence": "estimated: an argued boundary statement with evidence rows exceeds the express diff limits of 150 lines"
    }
  ],
  "status": "blocked",
  "owner_session": "unassigned",
  "claims": [],
  "timestamps": {
    "opened": "2026-08-03T12:00:00Z",
    "updated": "2026-08-03T12:00:00Z"
  }
}
